{
  "$schema": "http://json-schema.org/draft-07/schema#",
  "title": "AoE3 Mod Launcher — translation.json",
  "description": "Manifest shipped INSIDE every translation pack and committed next to the pack's .zip under translations/<id>/ on main. Usually generated by the launcher's Settings → Packager (don't hand-write the hashes).",
  "type": "object",
  "required": ["id", "name", "version", "compatibleWith", "files"],
  "additionalProperties": false,
  "properties": {
    "id": {
      "type": "string",
      "description": "Short pack id, also the folder name under translations/. e.g. \"es\", \"es-419\", \"fr\"."
    },
    "name": {
      "type": "string",
      "description": "Human-readable name shown in the launcher's language menu."
    },
    "language": {
      "type": "string",
      "description": "Optional BCP-47-style locale tag (informational). Defaults to id."
    },
    "author": {
      "type": "string",
      "description": "Translator credit."
    },
    "version": {
      "type": "string",
      "description": "Human pack version (e.g. \"1.0\"). Shown to users. NOT used for dedup — that's contentHash."
    },
    "compatibleWith": {
      "type": "array",
      "items": { "type": "string" },
      "description": "Mod versions the translator tested this pack against (exact membership, no ranges). The MD5 hash check at apply time is the final authority."
    },
    "files": {
      "type": "array",
      "minItems": 1,
      "description": "The translated files this pack ships.",
      "items": {
        "type": "object",
        "required": ["path", "originalHash", "translatedHash"],
        "additionalProperties": false,
        "properties": {
          "path": { "type": "string", "description": "Install-relative path with forward slashes, e.g. \"data/stringtabley.xml\"." },
          "originalHash": { "type": "string", "description": "MD5 of the canonical English file the translator started from." },
          "translatedHash": { "type": "string", "description": "MD5 of the translated file shipped in the .zip." },
          "size": { "type": "integer", "description": "Translated file size in bytes (informational)." }
        }
      }
    },
    "contentHash": {
      "type": "string",
      "description": "Fingerprint of the pack derived from files[].translatedHash (written by the packager). Drives the launcher's id@contentHash dedup key — a changed pack re-notifies users with NO version bump and NO release tag. Recompute if you hand-edit files."
    },
    "zip": {
      "type": "string",
      "description": "Filename of the pack's .zip in the SAME folder as this manifest, so the launcher can build the raw-CDN download URL. Defaults to <id>.zip."
    },
    "description": {
      "type": "string",
      "description": "Optional free-form description / changelog shown in the apply dialog."
    },
    "targetMod": {
      "type": "string",
      "description": "Mod id this pack targets (e.g. \"wol\"). Guards against applying a pack to the wrong mod. Empty = unverified (allowed)."
    }
  }
}
